<?xml version="1.0" encoding="UTF-8"?>
<!DOCTYPE SmallWorld SYSTEM "structure.dtd">
<SmallWorld>
  <board l="50" w="30">
    <tribe x="36" y="25" type="Human" />
    <tribe x="7" y="22" type="Robot" />
    <tribe x="10" y="5" type="Bee" />
    <case x="2" y="4">
      <ressource type="plutonium" life="100" />
    </case>
    <case x="2" y="6">
      <ressource type="rock" life="100" />
    </case>
    <case x="3" y="13">
      <ressource type="metal" life="100" />
    </case>
    <case x="5" y="2">
      <ressource type="food" life="100" />
    </case>
    <case x="7" y="14">
      <ressource type="wood" life="100" />
      <individual type="robot" life="50" team="2" />
      <individual type="robot" life="50" team="2" />
      <individual type="robot" life="50" team="2" />
    </case>
    <case x="10" y="10">
      <ressource type="rock" life="100" />
      <individual type="bee" life="100" team="3" />
      <individual type="bee" life="100" team="3" />
      <individual type="bee" life="100" team="3" />
      <individual type="bee" life="100" team="3" />
    </case>
    <case x="13" y="14">
      <ressource type="food" life="100" />
    </case>
    <case x="14" y="8">
      <ressource type="wood" life="100" />
    </case>
    <case x="20" y="16">
      <ressource type="metal" life="100" />
    </case>
    <case x="22" y="27">
      <ressource type="plutonium" life="100" />
    </case>
    <case x="33" y="27">
      <ressource type="plutonium" life="100" />
      <individual type="human" life="100" team="1" />
      <individual type="human" life="100" team="1" />
      <individual type="human" life="100" team="1" />
    </case>
    <case x="36" y="0">
      <ressource type="metal" life="100" />
    </case>
    <case x="36" y="2">
      <ressource type="food" life="100" />
    </case>
    <case x="47" y="9">
      <ressource type="wood" life="100" />
      <ressource type="rock" life="100" />
    </case>
  </board>
</SmallWorld>
