<?xml version="1.0" encoding="UTF-8"?>
<!DOCTYPE SmallWorld SYSTEM "structure.dtd">
<SmallWorld>
  <board l="60" w="60">
    <tribe x="25" y="21" type="robot" />
    <tribe x="8" y="9" type="human" />
    <tribe x="30" y="2" type="bee" />
    <case x="2" y="38">
      <ressource type="wood" life="100" />
    </case>
    <case x="2" y="45">
      <ressource type="wood" life="100" />
    </case>
    <case x="3" y="48">
      <ressource type="wood" life="100" />
    </case>
    <case x="4" y="31">
      <ressource type="rock" life="100" />
    </case>
    <case x="4" y="53">
      <ressource type="wood" life="100" />
    </case>
    <case x="5" y="12">
      <ressource type="wood" life="86" />
      <individual type="human" life="100" team="2" />
      <individual type="human" life="100" team="2" />
      <individual type="human" life="100" team="2" />
      <individual type="human" life="100" team="2" />
      <individual type="human" life="100" team="2" />
      <individual type="human" life="10" team="2" />
    </case>
    <case x="5" y="43">
      <ressource type="wood" life="100" />
    </case>
    <case x="6" y="39">
      <ressource type="wood" life="100" />
    </case>
    <case x="7" y="47">
      <ressource type="wood" life="100" />
    </case>
    <case x="7" y="50">
      <ressource type="wood" life="100" />
    </case>
    <case x="8" y="32">
      <ressource type="rock" life="100" />
    </case>
    <case x="9" y="54">
      <ressource type="wood" life="100" />
    </case>
    <case x="10" y="40">
      <ressource type="wood" life="100" />
    </case>
    <case x="10" y="43">
      <ressource type="wood" life="100" />
    </case>
    <case x="10" y="46">
      <ressource type="wood" life="100" />
    </case>
    <case x="10" y="49">
      <ressource type="wood" life="100" />
    </case>
    <case x="14" y="43">
      <ressource type="wood" life="12" />
      <individual type="robot" life="10" team="1" />
    </case>
    <case x="14" y="46">
      <ressource type="wood" life="100" />
    </case>
    <case x="14" y="50">
      <ressource type="wood" life="56" />
      <individual type="robot" life="10" team="1" />
    </case>
    <case x="15" y="32">
      <ressource type="rock" life="100" />
    </case>
    <case x="15" y="40">
      <ressource type="wood" life="100" />
    </case>
    <case x="20" y="32">
      <ressource type="rock" life="100" />
    </case>
    <case x="25" y="12">
      <individual type="bee" life="100" team="3" />
    </case>
    <case x="25" y="14">
      <ressource type="food" life="56" />
      <individual type="robot" life="30" team="1" />
      <individual type="robot" life="50" team="1" />
      <individual type="robot" life="50" team="1" />
      <individual type="robot" life="50" team="1" />
      <individual type="robot" life="50" team="1" />
      <individual type="robot" life="50" team="1" />
    </case>
    <case x="25" y="33">
      <ressource type="rock" life="100" />
    </case>
    <case x="30" y="33">
      <ressource type="rock" life="100" />
    </case>
    <case x="36" y="34">
      <ressource type="rock" life="100" />
    </case>
    <case x="43" y="34">
      <ressource type="rock" life="56" />
      <individual type="robot" life="10" team="1" />
    </case>
    <case x="49" y="35">
      <ressource type="rock" life="100" />
    </case>
    <case x="55" y="34">
      <ressource type="rock" life="100" />
    </case>
  </board>
</SmallWorld>
