<?xml version="1.0" encoding="UTF-8"?>
<!DOCTYPE SmallWorld SYSTEM "structure.dtd">
<SmallWorld>
  <board l="60" w="60">
	<tribe x = "25" y = "21" type = "robot"/>
	<tribe x = "8" y = "9" type = "human"/>
	<tribe x = "30" y = "2" type = "bee"/>
	
    <case x="5" y="12">
      <ressource type="wood" life="100" />
    </case>
    <case x="8" y="8">
      <individual type="human" team="2" />
    </case>
    <case x="17" y="44">
      <individual type="robot" team="1" />
    </case>
    <case x="25" y="14">
      <ressource type="food" life="100" />
    </case>
    <case x="25" y="22">
      <individual type="robot" team="1" />
    </case>
    <case x="26" y="54">
      <individual type="robot" team="1" />
    </case>
    <case x="31" y="1">
      <individual type="bee" team="3" />
    </case>
    <case x="40" y="42">
      <individual type="robot" team="1" />
	</case>
	 <case x="43" y="42">
      <ressource type="rock" life="10" />
	  <ressource type="wood" life="10" />
	  <ressource type="food" life="10" />
    </case>
  </board>
</SmallWorld>
