<?xml version="1.0" encoding="UTF-8"?>
<!DOCTYPE SmallWorld SYSTEM "structure.dtd">
<SmallWorld>
  <board l="70" w="50">
    <tribe x="50" y="10" type="robot" />
    <tribe x="32" y="7" type="human" />
    <tribe x="2" y="1" type="bee" />
    <tribe x="52" y="35" type="human" />
    <case x="33" y="15">
      <individual type="human" life="60" team="4" />
    </case>
  </board>
</SmallWorld>
